"Story","Title","Result","Date","Stability","Duration (s)"
"Account recon","Refresh accounts","SUCCESS","2023-09-25T20:08:32.481+08:00[Asia/Shanghai]","0.0","53.01"
"Annual statistical budget","Create annual statistical entry","SUCCESS","2023-09-25T20:09:26.265+08:00[Asia/Shanghai]","0.0","43.46"
"Batch posting","Batch posting voiding process","SUCCESS","2023-09-25T20:10:10.531+08:00[Asia/Shanghai]","0.0","112.51"
"Batch posting","Batch posting general ledger entry","SUCCESS","2023-09-25T20:12:03.72+08:00[Asia/Shanghai]","0.0","115.62"
"General ledger entries","Create general ledger entry","SUCCESS","2023-09-25T20:15:09.472+08:00[Asia/Shanghai]","0.0","106.18"
"Internal transfer","Create internal transfer entry","SUCCESS","2023-09-25T20:20:02.513+08:00[Asia/Shanghai]","0.0","77.93"
"Monthly statistical entries","Create monthly statistical entry","SUCCESS","2023-09-25T20:21:21.253+08:00[Asia/Shanghai]","0.0","46.86"
"Salary advance","Create salary advance entry","SUCCESS","2023-09-25T20:22:08.899+08:00[Asia/Shanghai]","0.0","86.55"
