"Story","Title","Result","Date","Stability","Duration (s)"
"Account recon","Refresh accounts","SUCCESS","2023-09-26T17:00:13.451+08:00[Asia/Shanghai]","0.0","43.91"
"Annual statistical budget","Create annual statistical entry","SUCCESS","2023-09-26T17:00:58.222+08:00[Asia/Shanghai]","0.0","40.49"
"Batch posting","Batch posting voiding process","SUCCESS","2023-09-26T17:01:39.57+08:00[Asia/Shanghai]","0.0","110.69"
"Batch posting","Batch posting general ledger entry","SUCCESS","2023-09-26T17:03:31.019+08:00[Asia/Shanghai]","0.0","110.41"
"General ledger entries","Create general ledger entry","SUCCESS","2023-09-26T17:06:31.506+08:00[Asia/Shanghai]","0.0","99.66"
"Internal transfer","Create internal transfer entry","SUCCESS","2023-09-26T17:10:45.423+08:00[Asia/Shanghai]","0.0","80.47"
"Monthly statistical entries","Create monthly statistical entry","SUCCESS","2023-09-26T17:12:06.715+08:00[Asia/Shanghai]","0.0","39.26"
"Salary advance","Create salary advance entry","SUCCESS","2023-09-26T17:12:47.058+08:00[Asia/Shanghai]","0.0","82.37"
