"Story","Title","Result","Date","Stability","Duration (s)"
"Manage bank account","Add a bank account","SUCCESS","2023-09-26T13:39:01.702+08:00[Asia/Shanghai]","0.0","62.66"
"Manage bank account","Edit a bank account","SUCCESS","2023-09-26T13:40:05.071+08:00[Asia/Shanghai]","0.0","71.26"
"Manage bank account","Search a bank account","SUCCESS","2023-09-26T13:41:17.022+08:00[Asia/Shanghai]","0.0","29.22"
"Manage bank account","Activate a bank account","SUCCESS","2023-09-26T13:41:46.949+08:00[Asia/Shanghai]","0.0","46.81"
"Manage bank account","Manage bank account using GVAGL bank account","SUCCESS","2023-09-26T13:42:34.418+08:00[Asia/Shanghai]","0.0","197.12"
